{
  "schema_version": 1,
  "release_id": "release-gate-test",
  "telemetry_url": "https://runtime.test/_gate/telemetry",
  "workload_provenance_url": "https://runtime.test/_gate/workload-provenance",
  "workload_server_sha256": "bbbbbbbbbbbbbbbbbbbbbbbbbbbbbbbbbbbbbbbbbbbbbbbbbbbbbbbbbbbbbbbb",
  "fault_driver": {"command": "/usr/bin/true", "args": ["{kind}", "{phase}"]},
  "origins": [
    {"id": "origin-01", "fixture_sha256": "aaaaaaaaaaaaaaaaaaaaaaaaaaaaaaaaaaaaaaaaaaaaaaaaaaaaaaaaaaaaaaaa", "page_url": "https://origin-01.test/page", "short_stream_url": "https://origin-01.test/short", "sse_url": "https://origin-01.test/events", "websocket_url": "wss://origin-01.test/socket"},
    {"id": "origin-02", "fixture_sha256": "aaaaaaaaaaaaaaaaaaaaaaaaaaaaaaaaaaaaaaaaaaaaaaaaaaaaaaaaaaaaaaaa", "page_url": "https://origin-02.test/page", "short_stream_url": "https://origin-02.test/short", "sse_url": "https://origin-02.test/events", "websocket_url": "wss://origin-02.test/socket"},
    {"id": "origin-03", "fixture_sha256": "aaaaaaaaaaaaaaaaaaaaaaaaaaaaaaaaaaaaaaaaaaaaaaaaaaaaaaaaaaaaaaaa", "page_url": "https://origin-03.test/page", "short_stream_url": "https://origin-03.test/short", "sse_url": "https://origin-03.test/events", "websocket_url": "wss://origin-03.test/socket"},
    {"id": "origin-04", "fixture_sha256": "aaaaaaaaaaaaaaaaaaaaaaaaaaaaaaaaaaaaaaaaaaaaaaaaaaaaaaaaaaaaaaaa", "page_url": "https://origin-04.test/page", "short_stream_url": "https://origin-04.test/short", "sse_url": "https://origin-04.test/events", "websocket_url": "wss://origin-04.test/socket"},
    {"id": "origin-05", "fixture_sha256": "aaaaaaaaaaaaaaaaaaaaaaaaaaaaaaaaaaaaaaaaaaaaaaaaaaaaaaaaaaaaaaaa", "page_url": "https://origin-05.test/page", "short_stream_url": "https://origin-05.test/short", "sse_url": "https://origin-05.test/events", "websocket_url": "wss://origin-05.test/socket"},
    {"id": "origin-06", "fixture_sha256": "aaaaaaaaaaaaaaaaaaaaaaaaaaaaaaaaaaaaaaaaaaaaaaaaaaaaaaaaaaaaaaaa", "page_url": "https://origin-06.test/page", "short_stream_url": "https://origin-06.test/short", "sse_url": "https://origin-06.test/events", "websocket_url": "wss://origin-06.test/socket"},
    {"id": "origin-07", "fixture_sha256": "aaaaaaaaaaaaaaaaaaaaaaaaaaaaaaaaaaaaaaaaaaaaaaaaaaaaaaaaaaaaaaaa", "page_url": "https://origin-07.test/page", "short_stream_url": "https://origin-07.test/short", "sse_url": "https://origin-07.test/events", "websocket_url": "wss://origin-07.test/socket"},
    {"id": "origin-08", "fixture_sha256": "aaaaaaaaaaaaaaaaaaaaaaaaaaaaaaaaaaaaaaaaaaaaaaaaaaaaaaaaaaaaaaaa", "page_url": "https://origin-08.test/page", "short_stream_url": "https://origin-08.test/short", "sse_url": "https://origin-08.test/events", "websocket_url": "wss://origin-08.test/socket"},
    {"id": "origin-09", "fixture_sha256": "aaaaaaaaaaaaaaaaaaaaaaaaaaaaaaaaaaaaaaaaaaaaaaaaaaaaaaaaaaaaaaaa", "page_url": "https://origin-09.test/page", "short_stream_url": "https://origin-09.test/short", "sse_url": "https://origin-09.test/events", "websocket_url": "wss://origin-09.test/socket"},
    {"id": "origin-10", "fixture_sha256": "aaaaaaaaaaaaaaaaaaaaaaaaaaaaaaaaaaaaaaaaaaaaaaaaaaaaaaaaaaaaaaaa", "page_url": "https://origin-10.test/page", "short_stream_url": "https://origin-10.test/short", "sse_url": "https://origin-10.test/events", "websocket_url": "wss://origin-10.test/socket"},
    {"id": "origin-11", "fixture_sha256": "aaaaaaaaaaaaaaaaaaaaaaaaaaaaaaaaaaaaaaaaaaaaaaaaaaaaaaaaaaaaaaaa", "page_url": "https://origin-11.test/page", "short_stream_url": "https://origin-11.test/short", "sse_url": "https://origin-11.test/events", "websocket_url": "wss://origin-11.test/socket"},
    {"id": "origin-12", "fixture_sha256": "aaaaaaaaaaaaaaaaaaaaaaaaaaaaaaaaaaaaaaaaaaaaaaaaaaaaaaaaaaaaaaaa", "page_url": "https://origin-12.test/page", "short_stream_url": "https://origin-12.test/short", "sse_url": "https://origin-12.test/events", "websocket_url": "wss://origin-12.test/socket"},
    {"id": "origin-13", "fixture_sha256": "aaaaaaaaaaaaaaaaaaaaaaaaaaaaaaaaaaaaaaaaaaaaaaaaaaaaaaaaaaaaaaaa", "page_url": "https://origin-13.test/page", "short_stream_url": "https://origin-13.test/short", "sse_url": "https://origin-13.test/events", "websocket_url": "wss://origin-13.test/socket"},
    {"id": "origin-14", "fixture_sha256": "aaaaaaaaaaaaaaaaaaaaaaaaaaaaaaaaaaaaaaaaaaaaaaaaaaaaaaaaaaaaaaaa", "page_url": "https://origin-14.test/page", "short_stream_url": "https://origin-14.test/short", "sse_url": "https://origin-14.test/events", "websocket_url": "wss://origin-14.test/socket"},
    {"id": "origin-15", "fixture_sha256": "aaaaaaaaaaaaaaaaaaaaaaaaaaaaaaaaaaaaaaaaaaaaaaaaaaaaaaaaaaaaaaaa", "page_url": "https://origin-15.test/page", "short_stream_url": "https://origin-15.test/short", "sse_url": "https://origin-15.test/events", "websocket_url": "wss://origin-15.test/socket"},
    {"id": "origin-16", "fixture_sha256": "aaaaaaaaaaaaaaaaaaaaaaaaaaaaaaaaaaaaaaaaaaaaaaaaaaaaaaaaaaaaaaaa", "page_url": "https://origin-16.test/page", "short_stream_url": "https://origin-16.test/short", "sse_url": "https://origin-16.test/events", "websocket_url": "wss://origin-16.test/socket"},
    {"id": "origin-17", "fixture_sha256": "aaaaaaaaaaaaaaaaaaaaaaaaaaaaaaaaaaaaaaaaaaaaaaaaaaaaaaaaaaaaaaaa", "page_url": "https://origin-17.test/page", "short_stream_url": "https://origin-17.test/short", "sse_url": "https://origin-17.test/events", "websocket_url": "wss://origin-17.test/socket"},
    {"id": "origin-18", "fixture_sha256": "aaaaaaaaaaaaaaaaaaaaaaaaaaaaaaaaaaaaaaaaaaaaaaaaaaaaaaaaaaaaaaaa", "page_url": "https://origin-18.test/page", "short_stream_url": "https://origin-18.test/short", "sse_url": "https://origin-18.test/events", "websocket_url": "wss://origin-18.test/socket"},
    {"id": "origin-19", "fixture_sha256": "aaaaaaaaaaaaaaaaaaaaaaaaaaaaaaaaaaaaaaaaaaaaaaaaaaaaaaaaaaaaaaaa", "page_url": "https://origin-19.test/page", "short_stream_url": "https://origin-19.test/short", "sse_url": "https://origin-19.test/events", "websocket_url": "wss://origin-19.test/socket"},
    {"id": "origin-20", "fixture_sha256": "aaaaaaaaaaaaaaaaaaaaaaaaaaaaaaaaaaaaaaaaaaaaaaaaaaaaaaaaaaaaaaaa", "page_url": "https://origin-20.test/page", "short_stream_url": "https://origin-20.test/short", "sse_url": "https://origin-20.test/events", "websocket_url": "wss://origin-20.test/socket"}
  ]
}
